ordem,bloco,quem,organizacao,nome,texto
59,PRIMEIRO,Candidato,UNIÃO,Soraya Thronicke,"Obrigada, candidata, pela pergunta. É um assunto que também me é caro. Poucas pessoas sabem, mas eu fui professora de inglês por muito tempo, então eu sei o que é que é uma sala de aula também. E como a senhora bem disse, a senhora foi minha professora, nós sabemos a importância da educação, e por isso a nossa primeira proposta, e revolucionária, é isentar... escutem bem, escutem bem, isentar de imposto de renda todos os professores. Todos os professores, tanto do ensino público quanto privado. Isso não é conto de fadas, isso é verdade, isso já foi estudado, o impacto é apenas de 10 bi por ano. Eu sei disso, isso é possível fazer, principalmente por conta do financiamento que o Imposto Único Federal vai proporcionar. Mas, além dessa valorização, que é a primeira coisa: a valorização de você, professor, que está ali na ponta e que é tão desvalorizado, começa por aí. E aí nós temos inúmeras propostas, propostas de... em relação ao analfabetismo funcional, a criação de metodologias autodidáticas; isso é muito importante para que as pessoas consigam, complementariamente ao professor, aprender sozinhas. Mas uma coisa que eu quero deixar aqui muito claro e que muito me preocupa: durante a pandemia, nós tivemos nossas crianças fora da escola, e o governo não conseguiu fazer um programa que resolvesse isso. Simples seria se ele utilizasse o mesmo método que utilizou o Presidente de Portugal, Marcelo Rebelo. Marcelo Rebelo é professor também, e ele foi para a TV estatal. Ele foi para a TV estatal dar aulas, e contratou os melhores professores do país para dar aula na TV aberta para os alunos. E aí nós temos a nossa EBC, que passou todo esse tempo fazendo campanha para o atual Presidente da República. Isso é grave, isso é sério em um governo que prometeu privatizar. Portanto, dentre tantas, e tantas, e tantas propostas nossas, que é, inclusive, incluir a iniciativa privada dentro do nosso sistema para conseguir resolver o problema... o que falta na educação pública, nós incluiremos também a capacidade da iniciativa privada para nos ajudar, porque, no Brasil, contrariamente ao que disse o ex-presidente Lula, atual candidato, nós gastamos muito, gastamos como primeiro mundo na educação e entregamos uma educação de quinta categoria. Isso tem que acabar."
60,PRIMEIRO,Candidato,MDB,Simone Tebet,"Sem dúvida, candidata Soraya, valorização do professor é fundamental, cuidar de quem cuida. Mas é mais do que isso. Ensinar o professor não apenas o que educar e ensinar, mas como educar e ensinar. Nós vamos atacar o problema desde a primeira infância. Vamos acabar com as mais de duas mil creches que estão paralisadas há muitos anos. E dinheiro tem do Fundeb, que nós dobramos e tá fora do teto. Vamos colocar todas as crianças de quatro a cinco dentro das nossas... do ensino infantil. Mas vamos atacar o maior problema que é o ensino médio. O ensino médio técnico profissionalizante sai do papel pra que os nossos jovens possam entrar no mercado de trabalho imediatamente. E pra isso, pra que eles não virem nem-nem, nem estudo nem trabalho, nós vamos colocar um poupança jovem. O nosso jovem vai ganhar dinheiro todo ano, e no final do terceiro ano do ensino médio, vai ganhar R$ 5.000 pra fazer o que ele quiser, dar uma entrada numa moto ou num celular, mas pra que ele não saia. Porque a educação vai ser prioridade pela primeira vez na história do Brasil. Eu sei porque sou professora. Eu sei que só a educação salva."
61,PRIMEIRO,Imprensa,Band,Eduardo Oinegue,Tempo.
62,PRIMEIRO,Candidato,UNIÃO,Soraya Thronicke,"Sem falar, brasileiros, do valor da merenda que não foi atualizado. As nossas crianças, muitas delas têm somente a merenda escolar pra comer. É triste demais. Nossas crianças sequer, muitas delas, não têm banheiro nas escolas. Então, assim, é sério. Estamos vivendo o maior caos já visto na história desse país. Isso tem que mudar, e eu tô aqui pra contar a verdade pra vocês, porque eu tô aqui dentro, estou nos bastidores, e agora eu posso falar."
63,PRIMEIRO,Imprensa,Band,Adriana Araújo,"Obrigada. Você está acompanhando o primeiro debate entre os candidatos à presidência da república realizado por um pool que reúne o Grupo Bandeirantes, o jornal Folha de S.Paulo, a TV Cultura e o UOL."
64,PRIMEIRO,Imprensa,Band,Eduardo Oinegue,Essa foi a última resposta do primeiro bloco. Logo depois do intervalo é a vez de jornalistas das empresas que integram o pool perguntarem aos candidatos.
65,PRIMEIRO,Imprensa,Band,Adriana Araújo,"Olho no voto, eleições 2022."
66,SEGUNDO,Imprensa,Band,Eduardo Oinegue,"Voltamos ao vivo com o primeiro debate das Eleições 2022 entre os candidatos à Presidência da República. O encontro é realizado por um pool que reúne a TV Cultura, o Grupo Bandeirantes, Folha de S.Paulo e o portal UOL, e está sendo transmitido pelas principais plataformas digitais e pela Band Internacional."
67,SEGUNDO,Imprensa,Band,Adriana Araújo,"Estamos ao vivo também no BandNews TV e nas rádios Bandeirantes e BandNews FM. Neste bloco, jornalistas das empresas que integram o pool fazem perguntas para os candidatos. Pelas regras definidas em comum acordo com os partidos, o jornalista escolhe um candidato para responder e outro para comentar."
68,SEGUNDO,Imprensa,Band,Eduardo Oinegue,"Os tempos são os mesmos do confronto anterior. O candidato que responde terá total de quatro minutos para administrar entre a resposta e a réplica, o comentário será de um minuto."
69,SEGUNDO,Imprensa,Band,Adriana Araújo,"Eu lembro que a ordem dos jornalistas para este bloco foi definida em sorteio entre os integrantes do pool. E quem faz a primeira pergunta, pela Band, é o jornalista Rodolfo Schneider. Por favor, Rodolfo, boa noite. Indica quem você vai perguntar e quem comenta."
70,SEGUNDO,Imprensa,Band,Rodolfo Schneider,"Boa noite. Minha pergunta é para o Presidente da República, candidato Jair Bolsonaro, e comentário do ex-presidente da República, e candidato, Lula. Um dos assuntos mais comentados nesse momento na nossa sala digital, em parceria com Google e YouTube na área de economia, é o Auxílio Emergencial. Acho que não se discute mais que o Brasil precisa de um programa de transferência de renda, seja Auxílio Brasil, Bolsa Família ou o nome que for. A minha pergunta é: Neste momento, aprovado até o final do ano, temos o auxílio a R$ 600, além de Auxílio Caminhoneiro e também Auxílio Taxista. No ano que vem, o orçamento prevê R$ 400, porém o presidente Bolsonaro e ex-Presidente já disseram que manteriam a R$ 600 esse valor. Mas de onde sairá esse dinheiro? Se romperá o teto de gastos? Retirará dinheiro de outros orçamentos de ministérios? Obrigado. Por favor, Bolsonaro, Presidente da República, e ex-Presidente Lula."
71,SEGUNDO,Candidato,PL,Jair Bolsonaro,"Até o ano passado era de R$ 192, em média. Nós passamos para 400, de forma definitiva, contra o voto do PT na Câmara. Ato contínuo, nós, nesse ano, por uma PEC, acrescentamos R$ 200 até o final do ano. Ou seja, no momento o Auxílio Brasil é de R$ 600. E nós vamos manter esse valor a partir do ano que vem. Logicamente, esse auxílio se aproxima do mínimo necessário para pessoa sobreviver, sair da linha da pobreza de forma mais concreta. Onde retirar dinheiro? Tenho acertado com a equipe econômica e conversado, dentro da responsabilidade fiscal. Quando, por exemplo, no ano passado passamos para R$ 400, ninguém acreditava. Nós conseguimos renegociar os precatórios, contra o voto do PT na Câmara, que para o PT, quanto pior estiver o povo, mais pobre, melhor é para eles fazerem política em cima disso. E, obviamente, quando se fala em Auxílio Emergencial para comprar alimentos, isso tem a ver com inflação. E nós conseguimos, no corrente ano, diminuir o teto do ICMS em todo Brasil, de forma que a gasolina, hoje, tem estados que já está abaixo de R$ 5. Tem estados também que o álcool, o etanol está abaixo de R$ 4. Contra o voto dos senadores do PT lá no Senado Federal. Como conseguir recursos? Não roubando, não metendo a mão no bolso do povo. O que é não roubar? Estatais, por exemplo. Nós podemos, está programado recursos das estatais irem para esse lado de cá do orçamento. Em governos anteriores, as estatais davam lucro muito baixo, ou até prejuízo. No nosso governo, o lucro está chegando à casa dos R$ 200 bilhões. E nós temos que deixar bem claro, quando se fala em orçamento como um todo, aumentando a arrecadação diminuindo impostos, como diminuímos o IPI por decreto. Como temos diminuído impostos de vários produtos, imposto de importação. Vários produtos. Ou seja, o governo está agindo na contramão do que sempre fizeram no passado. Por outro lado, muitas vezes, se fala em taxar grandes fortunas. Isso faz com que o capital vá embora. Ou seja, o nosso governo tem esse olhar, tem recurso, tem meios e fará com responsabilidade essa manutenção dos R$ 600."
72,SEGUNDO,Candidato,PT,Luiz Inácio Lula da Silva,"Bom, é importante lembrar que a manutenção dos R$ 600 não está na LDO, que foi mandada para o Congresso Nacional. Ou seja, significa que existe uma mentira no ar. Não está na LDO a manutenção de R$ 600. A segunda coisa que é inverdade, é que o PT, já faz dois anos que o PT tem reivindicado os R$ 600 no Bolsa Família, a bancada do PT votou favorável, porque a bancada do PT acha que o povo tem que receber efetivamente esse auxílio, mas é preciso que a gente faça essa política concomitante com a política de crescimento econômico, com a política de geração de emprego, de geração de oportunidade das pessoas. Coisa que não está pensado em nenhum momento. Então, o candidato, ele adora citar números absurdos que nem ele acredita... e saber o seguinte, já vendeu a Eletrobras, já vendeu a BR, tá fatiando a Petrobras, privatizou a BR..."
73,SEGUNDO,Imprensa,Band,Adriana Araújo,"Candidato Bolsonaro, o senhor tem um e trinta para a sua réplica."
74,SEGUNDO,Candidato,PL,Jair Bolsonaro,"Olha, o PT foi contra R$ 400 lá atrás. Votou, sim. Para de mentir. Está no teu DNA mentir e inventar números. No corrente ano, discursaram contra e votaram a favor. Questão de LDO: você resolve. Eu tenho contato com lideranças da Câmara. Após as eleições, podemos fazer algo mais concreto, mais detalhado para buscar recursos para pagar os R$ 600. Não podemos ser aqui inconsequentes, ficar anunciando ""vou dar isso, vou dar aquilo, vou tirar Imposto de Renda de professor"", não sei o quê lá. Só mentira. O orçamento é outra coisa. Temos um teto de gastos. E temos onde tirar recursos. Temos muita coisa planejada nesse tocante. Tenho certeza, os mais pobres, diferentemente do PT, lá atrás, por que o PT, lá atrás, não aumentou? Pagava uma miséria de Bolsa Família. Era uma miséria. Tinha gente que ganhava R$ 80 por mês. Família ganhando R$ 80 por mês; e nós, agora, entramos nessa área para valer. Está preocupado com votos. Apenas votos. Mas nada além disso. Mentindo sobre números. Lembra quando dizia que tinha 25 milhões de crianças abandonadas no Brasil e falou isso rindo, lá fora, do Brasil? Ou seja, nós temos ao nosso lado a verdade e a responsabilidade. Nunca tivemos tanto dinheiro de fora do Brasil investido aqui. Inclusive, em torno de 20% do nosso PIB. É um governo que está dando certo. A economia está bombando, e o Brasil está sendo exemplo para o mundo nessa área."
75,SEGUNDO,Imprensa,Band,Eduardo Oinegue,"Quem faz a próxima pergunta é a TV Cultura, com a jornalista Vera Magalhães. Vera, por favor, indica quem vai responder à sua pergunta e quem vai comentar, por favor."
76,SEGUNDO,Imprensa,Cultura,Vera Magalhães,"Boa noite a todos. Eu vou fazer uma pergunta ao candidato Ciro Gomes, com comentário do candidato Jair Bolsonaro. Candidato Ciro, a cobertura vacinal no Brasil vem despencando nos últimos anos. A cobertura para a vacinar tríplice viral, que protege contra sarampo e outras doenças, foi de 71%, em 2021, e ainda não chegou a 50% neste ano. A da poliomielite, que já chegou a ser de 96%, em 2012, caiu a índices um pouco superiores a 67%. Queria saber do senhor em que medida o senhor acha que a desinformação sobre vacinas, difundida inclusive pelo Presidente da República, pode ter contribuído, além de agravar a pandemia de Covid-19 e causar mortes que poderiam ter sido evitadas, também para desacreditar a população quanto à eficácia das vacinas em geral? E qual é a sua proposta para recuperar o Plano Nacional de Imunização, que já foi um orgulho nacional e uma referência para o mundo?"
77,SEGUNDO,Candidato,PDT,Ciro Gomes,"Vera, se você olhar o Brasil, tudo está fora do lugar. Mas é tudo mesmo está fora do lugar. É uma coisa que me choca ouvir o Presidente Bolsonaro dizer que a economia está bombando. Hoje, no Brasil, meu irmão? Vamos lá. Eu me emociono e quero segurar aqui a minha indignação. Mas espera um pouquinho, entre desalento, cinco milhões de brasileiros desistiram de procurar emprego. Entre desemprego aberto, que é o brasileiro que está indo de porta em porta, todo dia de manhã, pulando a catraca do ônibus porque não tem dinheiro para pagar passagem, e o trocador deixa, e volta para casa com a boca amarga: ""Não, não tem vaga, não tem vaga"", lá se vão mais dez milhões de brasileiros. Mas o que mais está me chocando, e vendo esse nível de alienação e de ódio, e de coisas assim, mentira para cá, mentira para lá... Isso é o Brasil que essa gente está produzindo, dividindo a nossa nação, e eu quero reconciliar. Espera um pouquinho, quase 50 milhões de pessoas não estão nos ouvindo nesse debate. Essa é a minha contradição. Eu falo por eles. Mas eles estão aí esfolados, vivendo na informalidade mais vil. Sabe o que é informalidade? Vou repetir para quem endureceu ou embruteceu o coração. Informalidade é uma jornada semanal de 50, 60 horas semanais, sem o descanso remunerado semanal para ir para o templo agradecer a Deus ou pedir luz. Sabe? Sem férias, sem 13 º. A saúde mental do nosso povo, Vera, está se deteriorando de um jeito? Nunca se pediu tanto, da rede de atenção psicossocial, remédios. Remédio para dormir, remédio para nervo. Mas sabe o que nós estamos produzindo? 50 milhões de brasileiros, em números redondos, vão envelhecer, daqui 15, 20 anos, Soraya, Senadora, e não vão ter cobertura à aposentadoria nenhuma. E aí, vamos lá, vacina. Isso é o trivial. Eu fui Governador, fui Prefeito de uma capital. Nossa meta era cumprir 100% da vacinação, e ganhamos prêmios internacionais. Fui ganhar prêmio de combate à mortalidade infantil, na ONU. Um dos elementos, foi que nós cobrimos 100% da população do Ceará. Havia campanha, esclarecimento, a vacina estava no tempo e na hora, bem acondicionada, bem transportada, era um grande mutirão. Sumiu tudo isso. É o desastre brasileiro por onde você queira considerar."
78,SEGUNDO,Candidato,PL,Jair Bolsonaro,"Vera, não podia esperar outra coisa de você. Acho que você dorme pensando em mim. Você tem alguma paixão por mim. Você não pode tomar partido em um debate como esse, fazer acusações mentirosas a meu respeito. Você é uma vergonha para o jornalismo brasileiro. Mas tudo bem [o presidente então se vira para Ciro Gomes, que havia falado com o microfone desligado]. Não pedi tua opinião."
79,SEGUNDO,Imprensa,Band,Adriana Araújo,"Por favor, candidatos. Por favor."
80,SEGUNDO,Candidato,PL,Jair Bolsonaro,"Já está apelando. A senhora falou uma frase, na CPI, seguinte, frase tua: ""Não é porque houve malversação de dinheiro público que devemos investigar"". A senhora foi conivente com a corrupção na CPI. Não achou nada contra mim. Escondeu Carlos Gabas. Escondeu Carlos Gabas, que desviou R$ 50 milhões e não foi investigado pela CPI. A senhora é uma vergonha no Senado Federal; e não estou atacando as mulheres, não. Não venha com essa historinha de atacar mulheres, de se vitimizar. Vera, você realmente foi fantástica, né? Deu oportunidade para falar um pouco de verdade sobre você."
81,SEGUNDO,Imprensa,Band,Eduardo Oinegue,"Candidato Ciro, sua réplica."
82,SEGUNDO,Candidato,PDT,Ciro Gomes,"É, vocês estão..."
83,SEGUNDO,Imprensa,Band,Eduardo Oinegue,Está registrado o pedido de direito de resposta.
84,SEGUNDO,Candidato,PDT,Ciro Gomes,"Eu quero reconciliar o Brasil. Enquanto persistir esse nível de agressividade, sabe? De PT... Ainda agora vinha entrando aqui na Bandeirantes, estava lá a turma do PT batendo no carro, atravessando bandeira; eu conheço isso. Isso vai produzir coisas que o Brasil não merece, e nós precisamos restaurar a paz, reconciliar o Brasil ao redor de um novo e generoso projeto nacional de desenvolvimento que mude esse modelo econômico. Brigam para valer, mas patrocinam o mesmo modelo econômico. Brigam para valer, mas patrocinam o mesmo modelo de governança política em que a corrupção e a fisiologia são o centro do modelo de organização da política brasileira esses últimos 30 anos. Mudar o Brasil significa devolver a condição que nós sabemos fazer. O Brasil era mencionado como exemplo em cobertura vacinal. A vacina está aí, tecnologicamente dominada, mas, infelizmente, nós vimos propaganda contra a vacina, disputa politiqueira com quem é o pai da vacina, propina na compra de vacina! Isso é onde nós estamos: muito próximo do fundo do poço. Eu tenho pedido a Deus, meu irmão, tenho pedido a Deus, tenho vontade assim, sabe, de me conectar com o seu coração para que a gente bote a mão na cabeça e pare um pouquinho para pensar. A ciência da insanidade é repetir o passado e achar que vai ter resultado diferente; não vai. Me dê uma oportunidade, vamos mudar o Brasil, está na hora. Chega de ódio, chega de incompetência, sabe? Chega de projeto... de falta de projeto, absoluta falta de projeto."
85,SEGUNDO,Imprensa,Band,Eduardo Oinegue,A Senadora Simone Tebet fez o pedido de direito de resposta; a comissão avaliou e o direito de resposta não foi concedido.
86,SEGUNDO,Imprensa,Band,Adriana Araújo,"Por favor, eu peço, por gentileza, que os assessores que estão aqui não participem, porque foi o combinado com todos os partidos. A próxima jornalista a perguntar é a representante da Folha de S.Paulo, Patrícia Campos Mello. Boa noite, Patrícia. A quem você dirige a sua pergunta e quem comenta, por favor?"
87,SEGUNDO,Imprensa,Folha de SP,Patrícia Campos Mello,"Boa noite a todos. Minha pergunta é para o ex-presidente da República, candidato Luiz Inácio Lula da Silva, com o comentário do candidato Ciro Gomes. Candidato, o senhor tem falado sobre a necessidade da união da esquerda, mas o senhor e o candidato Ciro Gomes vivem um clima de hostilidade. Recentemente, o candidato Ciro Gomes afirmou, abro aspas, ""que o senhor considera o povo um bando de imbecis"", e também afirmou que já viu o senhor se corrompendo. Em resposta, o senhor afirmou que não leva o Ciro a sério. Como o senhor espera atrair o apoio do candidato Ciro Gomes para um segundo turno, caso o senhor vá para o segundo turno e ele não, e, para o candidato Ciro Gomes, o senhor pretende apoiar o candidato Lula se ele for para o segundo turno e você não... o senhor não?"
88,SEGUNDO,Candidato,PT,Luiz Inácio Lula da Silva,"Olha, primeiro, ao responder essa pergunta, eu queria começar falando das vacinas. As pessoas se esquecem que foi exatamente em 2010 e em 2009, quando chegou a H1N1, nós vacinamos, em três meses, 83 milhões de pessoas nesse país. Então, se as pessoas não são vacinadas, é irresponsabilidade de quem comanda, porque, na verdade, nós temos condições, e o Brasil é lembrado no mundo inteiro como um país de muita competência em vacinação. A segunda coisa é o seguinte, eu falo sempre do Ciro Gomes uma coisa: eu tenho um profundo respeito pelo Ciro Gomes, sou grato ao Ciro Gomes, que esteve no governo comigo de 2003 a 2006, mas o Ciro, nesse instante, ele resolveu não estar conosco, a sair com candidatura própria; é um direito dele, não sou eu que vou impedir. Eu estou construindo uma aliança política com dez partidos políticos, todos os partidos de esquerda e progressistas, e nós vamos ver, se ganharmos as eleições, tentar ver, sabe, se ainda conseguimos atrair o PDT para participar conosco do governo. Eu sempre digo o seguinte: tem três pessoas no Brasil que eu trato com deferência: Mário Covas, Requião e Ciro Gomes. De vez em quando eles podem até falar mal de mim que não levo em conta, porque eu sei que eles têm o coração mais mole do que a língua. Eles têm o coração muito mais mole, são muito mais compreensivos aos problemas sociais. Então é o seguinte: eu espero que o Ciro, nessas eleições, não vá para Paris, eu espero que o Ciro fique aqui no Brasil, que a gente sente para conversar e possa construir a verdadeira aliança política que ele sabe que vai ser construída."
89,SEGUNDO,Candidato,PDT,Ciro Gomes,"O Lula é esse encantador de serpente, vai na emoção das pessoas, cativa. Nós temos uma relação bastante antiga, e ele quer sempre trazer a coisas pro lado pessoal. Não é pessoal. Eu atribuo ao Lula a contradição econômica do Lula, a contradição moral do Lula e do PT o Bolsonaro. Eu não acho que o Bolsonaro desceu de Marte com essas contradições todas. O Bolsonaro foi um protesto absolutamente reconhecido respeitosamente por mim contra a devastadora crise econômica que o Lula e o PT produziram e que ele apaga. Ele faz números assim e esquece. Se você tomar... E eu vou fazer isso durante esse debate. A média de crescimento econômico do período do PT é medíocre. É igualzinha à do Fernando Henrique Cardoso. O desemprego que tá aí de dez, o Bolsonaro recebeu com 12. Recebeu do PT. E a razão da minha... distanciamento é que infelizmente o Lula se deixou corromper mesmo. Tá com Geddel Vieira Lima, tá com Renan Calheiros, tá com Eunício Oliveira. Pesquise quem são essas pessoas."
90,SEGUNDO,Candidato,PT,Luiz Inácio Lula da Silva,"Mesmo assim, Ciro, nós ainda vamos conversar. E você vai pedir desculpa porque você sabe que você tá dizendo inverdades a meu respeito. Você sabe que tá dizendo inverdades. Agora, o que é importante a gente levar em conta é que quando o Ciro joga a responsabilidade da eleição do cidadão nas minhas costas, eu queria dizer que eu não fui pra Paris. Eu não saí do Brasil pra não votar no Haddad. Eu não saí do Brasil pra não votar... E fui preso pra não ganhar as eleições, porque sabiam que se eu tivesse liberdade, eu ganhava as eleições. E você sabe que eu fui absolvido em todos os 26 processos. Você sabe que eu fui absolvido em todos os processos. Fui absolvido na ONU, fui absolvido na primeira, na segunda instância e duas vezes na Suprema Corte. Agora é o seguinte: eu sou o único inocente que paga o preço de ser inocente, ou seja, eu sou culpado porque sou inocente. Eu continuo dizendo pra vocês o seguinte: nós vamos trabalhar para voltar a governar esse país, pra fazer a economia crescer, pra investir na educação, as pessoas se esquecem que quem criou o piso escolar fui eu. E muitos governadores não queriam sequer pagar o piso escolar. As pessoas se esquecem que nós espalhamos universidades por esse país afora. E vou dizer uma coisa pra você: o Prouni foi a maior revolução educacional que a gente fez nesse país. Milhões de meninos da periferia, meninos negros e negras que estudavam em escola pública tiveram a oportunidade de primeira vez fazer uma universidade que era privilégio de rico. Era privilégio da classe média alta. Aliás, Ciro, você sabe perfeitamente bem que esse país é tão contra a educação que o Peru teve a sua primeira universidade em 1554, e a nossa primeira foi em 1920. Ou seja, a elite brasileira nunca se preocupa a educar. Precisou um metalúrgico sem diploma cuidar disso."
91,SEGUNDO,Imprensa,Band,Eduardo Oinegue,Quem escolhe os candidatos pra responder e comentar e faz a pergunta agora pelo UOL é a jornalista Thaís Oyama.
92,SEGUNDO,Imprensa,UOL,Thaís Oyama,"Minha pergunta é pra candidata Simone Tebet com comentário da candidata Soraya Thronicke. Candidata, a senhora tem enfatizado na sua campanha o fato de ser mulher. Seu slogan é ""mulher vota em mulher"". E a senhora também já disse que gostaria de ser vista como uma feminista. Já a candidata Soraya Thronicke, ela afirma ter restrições ao que considera ser, por vezes, um comportamento vitimista da parte de algumas mulheres. Ela já disse, por exemplo, que diante de uma acusação de estupro, não é porque a acusadora é mulher que tem razão. Então minha pergunta é: em que medida a senhora concorda ou discorda da candidata Soraya Thronicke nessa crítica em relação ao suposto vitimismo feminino?"
